Symbol,Name,Last Sale,Net Change,% Change,Market Cap,Country,IPO Year,Volume,Sector,Industry
RCM,R1 RCM Inc. Common Stock,$25.87,-0.83,-3.109%,7198168141.00,United States,,186739,Consumer Services,Other Consumer Services
RCUS,Arcus Biosciences Inc. Common Stock,$28.615,-0.705,-2.405%,2051951747.00,,2018,185003,Health Care,Biotechnology: Pharmaceutical Preparations
RDN,Radian Group Inc. Common Stock,$22.15,-0.19,-0.85%,3884629832.00,United States,,259131,Finance,Property-Casualty Insurers
RDY,Dr. Reddy's Laboratories Ltd Common Stock,$54.24,-1.48,-2.656%,9001360039.00,India,,16582,Health Care,Biotechnology: Pharmaceutical Preparations
RE,Everest Re Group Ltd. Common Stock,$288.93,-4.13,-1.409%,11398922412.00,Bermuda,,32941,Finance,Property-Casualty Insurers
REG,Regency Centers Corporation Common Stock,$71.15,-1.36,-1.876%,12193157146.00,United States,1993,133263,Consumer Services,Real Estate Investment Trusts
REGI,Renewable Energy Group Inc. Common Stock,$61.15,-0.12,-0.196%,3086207234.00,United States,2012,566395,Basic Industries,Major Chemicals
REGN,Regeneron Pharmaceuticals Inc. Common Stock,$690.07,-16.04,-2.272%,74899702330.00,United States,1991,168350,Health Care,Biotechnology: Pharmaceutical Preparations
RELX,RELX PLC PLC American Depositary Shares (Each representing One Ordinary Share),$30.76,-0.20,-0.646%,59344609275.00,United Kingdom,2015,292091,Consumer Services,Publishing
RES,RPC Inc. Common Stock,$11.20,-0.28,-2.439%,2424730493.00,United States,,531973,Energy,Oilfield Services/Equipment
REXR,Rexford Industrial Realty Inc. Common Stock,$81.82,-0.83,-1.004%,13501738968.00,United States,2013,136373,Consumer Services,Real Estate Investment Trusts
REYN,Reynolds Consumer Products Inc. Common Stock,$30.50,0.30,0.993%,6399704865.00,United States,2020,96332,Capital Goods,Office Equipment/Supplies/Services
REZI,Resideo Technologies Inc. Common Stock ,$23.60,-0.07,-0.296%,3422440683.00,,2018,61436,Miscellaneous,Diversified Manufacture
RF,Regions Financial Corporation Common Stock,$21.77,0.23,1.068%,20401671337.00,United States,,5585404,Finance,Major Banks
RGA,Reinsurance Group of America Incorporated Common Stock,$114.50,-1.76,-1.514%,7670154969.00,United States,,63932,Finance,Life Insurance
RGEN,Repligen Corporation Common Stock,$148.98,-4.49,-2.926%,8257828361.00,United States,1986,291737,Health Care,Medical/Dental Instruments
RGLD,Royal Gold Inc. Common Stock,$136.44,-3.60,-2.571%,8955754052.00,United States,,141153,Finance,Diversified Financial Service
RH,RH Common Stock,$327.71,-9.45,-2.803%,8056945993.00,United States,2012,199447,Consumer Services,Other Specialty Stores
RHI,Robert Half International Inc. Common Stock,$113.445,-1.725,-1.498%,12571684708.00,United States,,94046,Technology,Diversified Commercial Services
RHP,Ryman Hospitality Properties Inc. (REIT),$96.27,-0.26,-0.269%,5308860173.00,United States,,60125,Consumer Services,Real Estate Investment Trusts
RIG,Transocean Ltd (Switzerland) Common Stock,$4.09,-0.10,-2.387%,2785516054.00,Switzerland,,4235456,Energy,Oil & Gas Production
RIO,Rio Tinto Plc Common Stock,$74.04,-0.77,-1.029%,119976345038.00,Australia,2002,1538940,Basic Industries,Steel/Iron Ore
RIVN,Rivian Automotive Inc. Class A Common Stock,$33.29,-0.47,-1.392%,29979371320.00,United States,2021,5061152,Capital Goods,Auto Manufacturing
RJF,Raymond James Financial Inc. Common Stock,$107.63,-2.13,-1.941%,22344207888.00,United States,,294502,Finance,Investment Bankers/Brokers/Service
RKLB,Rocket Lab USA Inc. Common Stock,$7.825,-0.045,-0.572%,3636876167.00,United States,2020,1271552,Capital Goods,Aerospace
RL,Ralph Lauren Corporation Common Stock,$112.06,-2.18,-1.908%,7975005509.00,United States,1997,171508,Consumer Non-Durables,Apparel
RLAY,Relay Therapeutics Inc. Common Stock,$28.42,0.50,1.791%,3081103371.00,United States,2020,164187,Health Care,Biotechnology: Pharmaceutical Preparations
RLI,RLI Corp. Common Stock (DE),$117.50,-1.48,-1.244%,5321582285.00,United States,,47421,Finance,Property-Casualty Insurers
RLJ,RLJ Lodging Trust Common Shares of Beneficial Interest $0.01 par value,$14.26,0.17,1.207%,2379004000.00,United States,2011,350681,Consumer Services,Real Estate Investment Trusts
RLX,RLX Technology Inc. American Depositary Shares each representing the right to receive one (1) Class A ordinary share,$1.9055,0.1555,8.886%,2564526321.00,,2021,5887644,Consumer Non-Durables,Farming/Seeds/Milling
RMBS,Rambus Inc. Common Stock,$26.05,-0.03,-0.115%,2870121114.00,United States,1997,77901,Technology,Semiconductors
RMD,ResMed Inc. Common Stock,$230.89,-8.11,-3.393%,33764024597.00,United States,,72129,Health Care,Medical/Dental Instruments
RNG,RingCentral Inc. Class A Common Stock,$93.69,0.57,0.612%,8848286439.00,,2013,209812,Technology,EDP Services
RNR,RenaissanceRe Holdings Ltd. Common Stock,$150.87,-1.90,-1.244%,6667382823.00,Bermuda,,24924,Finance,Property-Casualty Insurers
RNW,ReNew Energy Global plc Class A Ordinary Shares,$7.68,0.17,2.264%,3078138209.00,United Kingdom,,123071,,
ROG,Rogers Corporation Common Stock,$273.12,0.22,0.081%,5135532988.00,United States,,19344,Capital Goods,Industrial Machinery/Components
ROIC,Retail Opportunity Investments Corp. Common Stock (MD),$19.52,-0.07,-0.357%,2403575836.00,United States,,237397,Consumer Services,Real Estate Investment Trusts
ROIV,Roivant Sciences Ltd. Common Shares,$3.69,-0.01,-0.27%,2553746359.00,United Kingdom,,73422,,
ROK,Rockwell Automation Inc. Common Stock,$264.56,-7.20,-2.649%,30740846565.00,United States,,119282,Capital Goods,Industrial Machinery/Components
ROKU,Roku Inc. Class A Common Stock,$99.43,-0.12,-0.121%,13453104408.00,United States,2017,2515294,Consumer Services,Television Services
ROL,Rollins Inc. Common Stock,$33.96,-0.55,-1.594%,16723949615.00,United States,,205711,Technology,Industrial Specialties
ROLL,RBC Bearings Incorporated Common Stock,$182.53,-2.71,-1.463%,5270801808.00,United States,2005,12155,Capital Goods,Metal Fabrications
ROP,Roper Technologies Inc. Common Stock,$463.21,-6.07,-1.293%,48916289200.00,United States,1992,83275,Capital Goods,Office Equipment/Supplies/Services
ROST,Ross Stores Inc. Common Stock,$105.87,-1.31,-1.222%,37201907036.00,United States,1985,591937,Consumer Services,Clothing/Shoe/Accessory Stores
RPD,Rapid7 Inc. Common Stock,$106.67,-0.42,-0.392%,6195238182.00,United States,2015,53396,Technology,Computer Software: Prepackaged Software
RPM,RPM International Inc. Common Stock,$86.25,-1.18,-1.35%,11169002400.00,United States,,122002,Basic Industries,Paints/Coatings
RPRX,Royalty Pharma plc Class A Ordinary Shares ,$42.93,-0.66,-1.514%,18762923380.00,United States,2020,567795,Health Care,Biotechnology: Pharmaceutical Preparations
RQI,Cohen & Steers Quality Income Realty Fund Inc Common Shares,$16.38,-0.18,-1.087%,2199840683.00,United States,2002,66113,Finance,Trusts Except Educational Religious and Charitable
RRC,Range Resources Corporation Common Stock,$31.175,-0.485,-1.532%,8192021131.00,United States,,1155745,Energy,Oil & Gas Production
RRR,Red Rock Resorts Inc. Class A Common Stock,$45.26,-0.43,-0.941%,2773082870.00,United States,2016,105782,Consumer Services,Recreational Products/Toys
RRX,Regal Rexnord Corporation Common Stock,$140.63,-2.31,-1.616%,9454215279.00,United States,,51273,Consumer Durables,Metal Fabrications
RS,Reliance Steel & Aluminum Co. Common Stock (DE),$195.11,-2.12,-1.075%,12086593309.00,United States,1994,97973,Basic Industries,Steel/Iron Ore
RSG,Republic Services Inc. Common Stock,$133.96,-0.85,-0.631%,42302711716.00,United States,1998,220976,Public Utilities,Environmental Services
RTX,Raytheon Technologies Corporation Common Stock,$101.41,-0.32,-0.315%,151128116112.00,United States,,1234575,Capital Goods,Military/Government/Technical
RUN,Sunrun Inc. Common Stock,$20.67,-0.36,-1.712%,4332266082.00,United States,2015,3393918,Capital Goods,Building Products
RUSHA,Rush Enterprises Inc. Common Stock Cl A,$49.86,0.09,0.181%,2821185550.00,United States,,64131,Consumer Services,Other Specialty Stores
RUSHB,Rush Enterprises Inc. Class B,$47.40,-0.11,-0.232%,2681993483.00,United States,,3852,Consumer Services,Other Specialty Stores
RVLV,Revolve Group Inc. Class A Common Stock,$47.79,-1.44,-2.925%,3500946439.00,,2019,314735,Consumer Services,Catalog/Specialty Distribution
RXT,Rackspace Technology Inc. Common Stock,$10.32,-0.13,-1.244%,2187529399.00,United States,2020,64500,Technology,EDP Services
RY,Royal Bank Of Canada Common Stock,$106.57,-3.61,-3.276%,150969209279.00,Canada,,1401543,,
RYAAY,Ryanair Holdings plc American Depositary Shares,$91.87,-2.41,-2.556%,20845827118.00,Ireland,1997,83935,Transportation,Air Freight/Delivery Services
RYAN,Ryan Specialty Group Holdings Inc. Class A Common Stock,$39.53,-1.32,-3.231%,4344131482.00,,2021,108837,,
RYN,Rayonier Inc. REIT Common Stock,$44.71,-0.16,-0.357%,6515722475.00,United States,,129724,Consumer Services,Real Estate Investment Trusts
S,SentinelOne Inc. Class A Common Stock,$33.54,0.01,0.03%,9114675613.00,United States,2021,792367,Technology,EDP Services
SABR,Sabre Corporation Common Stock,$10.87,0.01,0.092%,3516779383.00,United States,2014,959287,Transportation,Other Consumer Services
SAFE,Safehold Inc. Common Stock,$46.675,0.025,0.054%,2891131555.00,United States,2017,86922,Consumer Services,Real Estate Investment Trusts
SAFM,Sanderson Farms Inc. Common Stock,$189.17,0.67,0.355%,4222860259.00,United States,1987,48694,,
SAIA,Saia Inc. Common Stock,$209.28,-0.04,-0.019%,5526360063.00,United States,,72521,Transportation,Trucking Freight/Courier Services
SAIC,SCIENCE APPLICATIONS INTERNATIONAL CORPORATION Common Stock,$89.09,-0.81,-0.901%,4993485947.00,,,74493,Technology,EDP Services
SAIL,SailPoint Technologies Holdings Inc. Common Stock,$64.16,0.06,0.094%,6043339536.00,United States,2017,3278422,Technology,Computer Software: Prepackaged Software
SAM,Boston Beer Company Inc. (The) Common Stock,$356.54,10.57,3.055%,4389699444.00,United States,,178079,Consumer Non-Durables,Beverages (Production/Distribution)
SAN,Banco Santander S.A. Sponsored ADR (Spain),$3.415,-0.005,-0.146%,58330628164.00,Spain,,2508899,Finance,Commercial Banks
SANM,Sanmina Corporation Common Stock,$40.035,-0.435,-1.075%,2544483637.00,United States,1993,35467,Technology,Electrical Products
SAP,SAP  SE ADS,$105.44,-0.90,-0.846%,124374845610.00,Germany,,846187,Technology,EDP Services
SATS,EchoStar  Corporation Common Stock,$24.885,0.015,0.06%,2124653777.00,United States,,39335,Technology,Radio And Television Broadcasting And Communications Equipment
SAVE,Spirit Airlines Inc. Common Stock,$25.75,0.33,1.298%,2796774914.00,United States,,770614,Transportation,Air Freight/Delivery Services
SBAC,SBA Communications Corporation Class A Common Stock,$364.78,-5.38,-1.453%,39402525524.00,United States,1999,70954,Consumer Services,Real Estate Investment Trusts
SBCF,Seacoast Banking Corporation of Florida Common Stock,$34.32,-0.56,-1.606%,2101548718.00,United States,,28065,Finance,Major Banks
SBLK,Star Bulk Carriers Corp. Common Shares,$30.355,0.945,3.213%,3117157773.00,Greece,,721343,Transportation,Marine Transportation
SBNY,Signature Bank Common Stock,$266.955,0.765,0.287%,16751759410.00,United States,2004,296416,Finance,Major Banks
SBRA,Sabra Health Care REIT Inc. Common Stock,$12.259,-0.191,-1.534%,2830654808.00,United States,,432147,Consumer Services,Real Estate Investment Trusts
SBS,Companhia de saneamento Basico Do Estado De Sao Paulo - Sabesp American Depositary Shares (Each repstg 250 Common Shares),$9.715,-0.105,-1.069%,6640298377.00,Brazil,2002,555257,Public Utilities,Water Supply
SBSW,D/B/A Sibanye-Stillwater Limited ADS,$14.55,-0.44,-2.935%,10215577800.00,,,1676924,Basic Industries,Precious Metals
SBUX,Starbucks Corporation Common Stock,$78.435,-0.525,-0.665%,90223780500.00,United States,1992,3234337,Consumer Non-Durables,Beverages - Non-Alcoholic
SCCO,Southern Copper Corporation Common Stock,$66.60,-1.57,-2.303%,51487798595.00,United States,,406198,Basic Industries,Precious Metals
SCHW,Charles Schwab Corporation (The) Common Stock,$71.32,-1.95,-2.661%,135172600013.00,United States,,4393463,Finance,Investment Bankers/Brokers/Service
SCI,Service Corporation International Common Stock,$69.59,-1.22,-1.723%,11187324378.00,United States,,147584,Miscellaneous,Other Consumer Services
SCL,Stepan Company Common Stock,$98.76,-2.01,-1.995%,2214502986.00,United States,,8420,Consumer Non-Durables,Package Goods/Cosmetics
SE,Sea Limited American Depositary Shares each representing one Class A Ordinary Share,$90.70,-0.52,-0.57%,50586832972.00,United States,2017,2679568,Technology,Computer Software: Prepackaged Software
SEAS,SeaWorld Entertainment Inc. Common Stock,$71.55,1.12,1.59%,5412710420.00,United States,2013,434983,Consumer Services,Movies/Entertainment
SEB,Seaboard Corporation Common Stock,$4290.00,18.80,0.44%,4979741910.00,United States,1996,66,Finance,Diversified Financial Service
SEDG,SolarEdge Technologies Inc. Common Stock,$258.04,3.89,1.531%,14222817736.00,Israel,2015,289224,Technology,Semiconductors
SEE,Sealed Air Corporation Common Stock,$66.685,-1.495,-2.193%,9741508512.00,United States,,130463,Basic Industries,Containers/Packaging
SEIC,SEI Investments Company Common Stock,$56.89,-0.15,-0.263%,7870961961.00,United States,1981,160982,Finance,Investment Bankers/Brokers/Service
SEM,Select Medical Holdings Corporation Common Stock,$22.88,-1.53,-6.268%,3060137789.00,United States,2009,269970,Health Care,Hospital/Nursing Management
SES,SES AI Corporation Class A Common Stock,$8.19,-0.13,-1.563%,2849063859.00,,2021,62421,Capital Goods,Auto Parts:O.E.M.
SF,Stifel Financial Corporation Common Stock,$66.34,-1.19,-1.762%,7059954280.00,United States,,61689,Finance,Investment Bankers/Brokers/Service
SFBS,ServisFirst Bancshares Inc. Common Stock,$84.98,-0.43,-0.503%,4612895577.00,United States,,11214,Finance,Major Banks
SFM,Sprouts Farmers Market Inc. Common Stock,$31.8126,-0.3274,-1.019%,3513786832.00,United States,2013,300542,Consumer Non-Durables,Specialty Foods
SFNC,Simmons First National Corporation Class A Common Stock,$25.31,-0.18,-0.706%,3286755081.00,United States,,91185,Finance,Major Banks
SG,Sweetgreen Inc. Class A Common Stock,$28.47,0.45,1.606%,3139695999.00,,2021,55472,Consumer Services,Restaurants
SGEN,Seagen Inc. Common Stock,$139.75,-1.69,-1.195%,25688731244.00,United States,2001,155187,Health Care,Biotechnology: Biological Products (No Diagnostic Substances)
SGFY,Signify Health Inc. Class A Common Stock,$15.11,-0.16,-1.048%,2660957898.00,,2021,222808,Technology,Retail: Computer Software & Peripheral Equipment
SGHC,Super Group (SGHC) Limited Ordinary Shares,$9.405,0.215,2.339%,4610307187.00,,2022,67627,Finance,Business Services
SGMS,Scientific Games Corp Common Stock,$59.51,-0.11,-0.185%,5753213219.00,United States,,103858,Consumer Services,Movies/Entertainment
SGRY,Surgery Partners Inc. Common Stock,$53.29,-6.85,-11.39%,4791032814.00,United States,2015,276881,Health Care,Managed Health Care
SHAK,Shake Shack Inc. Class A Common Stock,$62.575,-0.615,-0.973%,2632211868.00,United States,2015,134388,Consumer Services,Restaurants
SHC,Sotera Health Company Common Stock,$21.86,-0.05,-0.228%,6182384735.00,United States,2020,45028,Health Care,Medical Specialities
SHEL,Royal Dutch Shell PLC American Depositary Shares (each representing two (2) Ordinary Shares) ,$56.14,-0.57,-1.005%,211660739540.00,Netherlands,,817591,Energy,Oil & Gas Production
SHG,Shinhan Financial Group Co Ltd American Depositary Shares,$33.42,0.32,0.967%,17138485039.00,South Korea,,27674,Finance,Major Banks
SHI,SINOPEC Shangai Petrochemical Company Ltd. Common Stock,$18.82,0.32,1.73%,2037041701.00,China,,3092,Basic Industries,Major Chemicals
SHLX,Shell Midstream Partners L.P. Common Units representing Limited Partner Interests,$14.18,-0.07,-0.491%,5576845635.00,United States,2014,285081,Energy,Oilfield Services/Equipment
SHO,Sunstone Hotel Investors Inc. Sunstone Hotel Investors Inc. Common Shares,$12.26,0.06,0.492%,2649800180.00,United States,2004,555338,Consumer Services,Real Estate Investment Trusts
SHOO,Steven Madden Ltd. Common Stock,$42.44,-0.55,-1.279%,3389364542.00,United States,1993,203079,Consumer Non-Durables,Shoe Manufacturing
SHOP,Shopify Inc. Class A Subordinate Voting Shares,$475.0376,-5.9624,-1.24%,59831808010.00,Canada,2015,1643066,,
SHW,Sherwin-Williams Company (The) Common Stock,$247.52,-4.09,-1.626%,64490751358.00,United States,,436454,Basic Industries,Paints/Coatings
SI,Silvergate Capital Corporation Class A Common Stock,$135.52,4.97,3.807%,4286540289.00,United States,2019,292848,,
SID,Companhia Siderurgica Nacional S.A. Common Stock,$4.69,-0.06,-1.263%,6292732460.00,Brazil,,3491272,Basic Industries,Steel/Iron Ore
SIG,Signet Jewelers Limited Common Shares,$78.17,-2.21,-2.749%,3898612355.00,Bermuda,,301896,Consumer Services,Consumer Specialties
SIGI,Selective Insurance Group Inc. Common Stock,$84.25,-1.21,-1.416%,5083208669.00,United States,,41619,Finance,Property-Casualty Insurers
SIM,Grupo Simec S.A.B. de C.V. American Depositary Shares,$31.00,0.00,0.00%,4780000887.00,Mexico,1993,108,Basic Industries,Steel/Iron Ore
SIMO,Silicon Motion Technology Corporation American Depositary Shares,$77.215,0.535,0.698%,2696746461.00,Taiwan,2005,153794,Technology,Semiconductors
SIRI,Sirius XM Holdings Inc. Common Stock,$6.325,-0.025,-0.394%,24914879978.00,United States,,3042422,Consumer Services,Broadcasting
SITC,SITE Centers Corp. Common Stock,$16.70,-0.11,-0.654%,3570919250.00,United States,,279307,Consumer Services,Real Estate Investment Trusts
SITE,SiteOne Landscape Supply Inc. Common Stock,$146.98,-2.68,-1.791%,6595448826.00,United States,2016,41679,,
SITM,SiTime Corporation Common Stock,$168.37,0.84,0.501%,3506261474.00,United States,2019,47734,Technology,Semiconductors
SIVB,SVB Financial Group Common Stock,$564.70,61.57,12.237%,33209770955.00,United States,,533391,Finance,Major Banks
SIX,Six Flags Entertainment Corporation New Common Stock,$41.27,-0.44,-1.055%,3559317944.00,United States,,246531,Consumer Services,Movies/Entertainment
SJI,South Jersey Industries Inc. Common Stock,$34.60,0.10,0.29%,4235296974.00,United States,,229541,Public Utilities,Oil/Gas Transmission
SJM,J.M. Smucker Company (The) New Common Stock,$143.18,-0.48,-0.334%,15529072853.00,United States,,130036,Consumer Non-Durables,Packaged Foods
SJR,Shaw Communications Inc. Common Stock,$30.425,-0.395,-1.282%,15188981962.00,Canada,,139820,,
SKIN,The Beauty Health Company Class A Common Stock,$13.375,-0.345,-2.515%,2014248879.00,United States,2020,404338,Consumer Non-Durables,Package Goods/Cosmetics
SKM,SK Telecom Co. Ltd. Common Stock,$27.18,-0.24,-0.875%,10676246677.00,South Korea,,41740,Public Utilities,Telecommunications Equipment
SKX,Skechers U.S.A. Inc. Common Stock,$40.42,-0.76,-1.846%,6457504859.00,United States,1999,322650,Consumer Non-Durables,Shoe Manufacturing
SKY,Skyline Champion Corporation Common Stock,$51.375,0.375,0.735%,2919493907.00,United States,,75342,Basic Industries,Homebuilding
SLAB,Silicon Laboratories Inc. Common Stock,$129.03,-0.82,-0.631%,4923749575.00,United States,2000,73885,Technology,Semiconductors
SLB,Schlumberger N.V. Common Stock,$41.87,1.22,3.001%,59167919994.00,France,,8130607,Energy,Oilfield Services/Equipment
SLF,Sun Life Financial Inc. Common Stock,$52.97,-1.04,-1.926%,31044051358.00,Canada,,174376,Technology,Advertising
SLG,SL Green Realty Corp Common Stock,$74.99,-0.27,-0.359%,4857157043.00,United States,1997,120176,Consumer Services,Real Estate Investment Trusts
SLGN,Silgan Holdings Inc. Common Stock,$45.52,-0.69,-1.493%,5025873624.00,United States,1997,25614,Consumer Durables,Containers/Packaging
SLM,SLM Corporation Common Stock,$17.115,-0.085,-0.494%,4781810322.00,United States,,276786,Finance,Finance: Consumer Services
SM,SM Energy Company Common Stock,$36.73,-1.22,-3.215%,4476071221.00,United States,,877974,Energy,Oil & Gas Production
SMAR,Smartsheet Inc. Class A Common Stock,$49.26,-0.03,-0.061%,6336972406.00,United States,2018,160048,Technology,EDP Services
SMCI,Super Micro Computer Inc. Common Stock,$43.08,0.36,0.843%,2234324211.00,United States,2020,103170,Technology,Computer Manufacturing
SMFG,Sumitomo Mitsui Financial Group Inc Unsponsored American Depositary Shares (Japan),$6.075,-0.065,-1.059%,41638650848.00,Japan,,252886,Finance,Commercial Banks
SMG,Scotts Miracle-Gro Company (The) Common Stock,$104.78,-3.51,-3.241%,5824079575.00,United States,1992,146728,Basic Industries,Agricultural Chemicals
SMPL,The Simply Good Foods Company Common Stock,$43.125,-0.065,-0.15%,4328458967.00,United States,,194484,Consumer Non-Durables,Packaged Foods
SMTC,Semtech Corporation Common Stock,$60.59,-0.91,-1.48%,3884201626.00,United States,,55410,Technology,Semiconductors
SNA,Snap-On Incorporated Common Stock,$225.56,-0.63,-0.279%,12048712581.00,United States,,116318,Capital Goods,Diversified Manufacture
SNAP,Snap Inc. Class A Common Stock,$30.565,1.145,3.892%,49646631356.00,United States,2017,38395607,Technology,Internet and Information Services
SNDR,Schneider National Inc. Common Stock,$22.91,0.14,0.615%,4070144413.00,United States,2017,142107,Transportation,Trucking Freight/Courier Services
SNN,Smith & Nephew SNATS Inc. Common Stock,$33.29,-0.42,-1.246%,14518645326.00,United Kingdom,,312520,Health Care,Industrial Specialties
SNOW,Snowflake Inc. Class A Common Stock,$175.97,0.83,0.474%,55360162000.00,United States,2020,1332098,Technology,Computer Software: Prepackaged Software
SNP,China Petroleum & Chemical Corporation Common Stock,$50.19,0.91,1.847%,60765640098.00,China,,44886,Energy,Integrated oil Companies
SNPS,Synopsys Inc. Common Stock,$295.21,-0.29,-0.098%,45196272246.00,United States,1992,132671,Technology,EDP Services
SNV,Synovus Financial Corp. Common Stock,$44.98,-1.05,-2.281%,6543176504.00,United States,,218404,Finance,Major Banks
SNX,TD SYNNEX Corporation Common Stock,$101.56,-1.72,-1.665%,9760312287.00,United States,2003,102993,Technology,EDP Services
SNY,Sanofi ADS,$54.61,-0.62,-1.123%,136378325404.00,France,,304085,Health Care,Biotechnology: Pharmaceutical Preparations
SO,Southern Company (The) Common Stock,$76.30,-0.16,-0.209%,81123809682.00,United States,,1316408,Public Utilities,Power Generation
SOFI,SoFi Technologies Inc. Common Stock  ,$6.52,-0.08,-1.212%,5288657074.00,United States,,17562631,Finance,Diversified Financial Services
SON,Sonoco Products Company Common Stock,$64.20,-2.61,-3.907%,6258993783.00,United States,,210795,Basic Industries,Containers/Packaging
SONO,Sonos Inc. Common Stock,$23.73,-1.09,-4.392%,3028152363.00,United States,2018,1271711,Consumer Services,Consumer Electronics/Video Chains
SONY,Sony Group Corporation American Depositary Shares ,$86.58,-1.57,-1.781%,107099775584.00,Japan,,242714,Consumer Non-Durables,Consumer Electronics/Appliances
SPB,Spectrum Brands Holdings Inc. Common Stock,$87.19,-1.15,-1.302%,3555222384.00,United States,,61154,,
SPCE,Virgin Galactic Holdings Inc. Common Stock,$8.065,0.075,0.939%,2083104438.00,,2017,3235048,Finance,Diversified Financial Service
SPG,Simon Property Group Inc. Common Stock,$128.61,-2.24,-1.712%,42229130668.00,United States,,345650,Consumer Services,Real Estate Investment Trusts
SPGI,S&P Global Inc. Common Stock,$383.64,-7.19,-1.84%,133133386872.00,United States,,394174,Technology,Advertising
SPLK,Splunk Inc. Common Stock,$125.36,-0.50,-0.397%,20145352000.00,United States,2012,231481,Technology,Computer Software: Prepackaged Software
SPOT,Spotify Technology S.A. Ordinary Shares,$112.67,0.05,0.044%,21706904064.00,Luxembourg,2018,792103,Consumer Services,Broadcasting
SPR,Spirit Aerosystems Holdings Inc. Common Stock,$45.33,-0.19,-0.417%,4757006309.00,United States,2006,168518,Capital Goods,Military/Government/Technical
SPSC,SPS Commerce Inc. Common Stock,$124.97,-0.44,-0.351%,4515773579.00,United States,2010,32003,Technology,EDP Services
SPT,Sprout Social Inc Class A Common Stock,$64.45,0.45,0.703%,3506563568.00,United States,2019,69263,Technology,EDP Services
SPWR,SunPower Corporation Common Stock,$18.49,0.02,0.108%,3214405551.00,United States,2005,1138654,Technology,Semiconductors
SPXC,SPX Corporation Common Stock,$45.30,-0.61,-1.329%,2074056695.00,United States,,12053,Capital Goods,Industrial Machinery/Components
SQ,Block Inc. Class A Common Stock,$105.24,-2.47,-2.293%,61045309392.00,United States,2015,4311626,Technology,Computer Software: Prepackaged Software
SQM,Sociedad Quimica y Minera S.A. Common Stock,$78.485,-0.335,-0.425%,22418334219.00,Chile,1993,362883,Basic Industries,Agricultural Chemicals
SQSP,Squarespace Inc. Class A Common Stock,$21.3928,0.4828,2.309%,2993018429.00,,2021,122399,Technology,EDP Services
SR,Spire Inc. Common Stock,$77.12,-0.87,-1.116%,3990976735.00,United States,,33582,Public Utilities,Oil/Gas Transmission
SRAD,Sportradar Group AG Class A Ordinary Shares,$13.27,-0.04,-0.301%,3923138779.00,Switzerland,2021,52413,,
SRC,Spirit Realty Capital Inc. Common Stock,$46.76,-0.64,-1.35%,5973457295.00,United States,2013,159991,Consumer Services,Real Estate Investment Trusts
SRCL,Stericycle Inc. Common Stock,$54.425,-1.135,-2.043%,5011825070.00,United States,1996,73017,Public Utilities,Environmental Services
SRE,DBA Sempra Common Stock,$169.32,-1.11,-0.651%,53466518596.00,United States,,342513,Public Utilities,Oil/Gas Transmission
SRPT,Sarepta Therapeutics Inc. Common Stock (DE),$76.14,-1.21,-1.564%,6635569706.00,United States,,96579,Health Care,Biotechnology: Pharmaceutical Preparations
SSB,SouthState Corporation Common Stock,$81.16,-1.51,-1.827%,6188161801.00,United States,,97366,Finance,Major Banks
SSD,Simpson Manufacturing Company Inc. Common Stock,$106.92,-2.63,-2.401%,4635482065.00,United States,,19136,Capital Goods,Industrial Specialties
SSL,Sasol Ltd. American Depositary Shares,$24.39,0.17,0.702%,15497286635.00,South Africa,,159321,Energy,Oil & Gas Production
