Symbol,Name,Last Sale,Net Change,% Change,Market Cap,Country,IPO Year,Volume,Sector,Industry
CHNG,Change Healthcare Inc. Common Stock,$23.62,0.01,0.042%,7368472194.00,United States,2019,868018,Health Care,Managed Health Care
CHPT,ChargePoint Holdings Inc. Common Stock,$14.847,0.227,1.553%,4987702397.00,United States,2019,3737239,Miscellaneous,Diversified Commercial Services
CHRW,C.H. Robinson Worldwide Inc. Common Stock,$103.14,-0.10,-0.097%,13053876763.00,United States,1997,150514,Transportation,Oil Refining/Marketing
CHT,Chunghwa Telecom Co. Ltd.,$44.46,0.12,0.271%,34489607317.00,Taiwan,,22856,Public Utilities,Telecommunications Equipment
CHTR,Charter Communications Inc. Class A Common Stock New,$508.43,-10.60,-2.042%,104176888562.00,United States,,462529,Consumer Services,Television Services
CHWY,Chewy Inc. Class A Common Stock,$36.095,-1.035,-2.788%,15177303890.00,,2019,1384029,Consumer Services,Catalog/Specialty Distribution
CHX,ChampionX Corporation Common Stock ,$23.305,-0.545,-2.285%,4737802793.00,United States,,540431,Capital Goods,Construction/Ag Equipment/Trucks
CI,Cigna Corporation Common Stock,$258.50,-6.11,-2.309%,82300392460.00,United States,,254088,Health Care,Medical Specialities
CIB,BanColombia S.A. Common Stock,$41.935,-0.705,-1.653%,10083553811.00,Colombia,,57280,Finance,Commercial Banks
CIEN,Ciena Corporation Common Stock,$56.85,-0.45,-0.785%,8648388171.00,United States,1997,155232,Public Utilities,Telecommunications Equipment
CIG,Comp En De Mn Cemig ADS American Depositary Shares,$3.085,-0.025,-0.804%,5222013966.00,Brazil,,2262057,Public Utilities,Electric Utilities: Central
CIGI,Colliers International Group Inc. Subordinate Voting Shares,$121.15,-1.75,-1.424%,5361855973.00,Canada,,20407,,
CIM,Chimera Investment Corporation Common Stock,$10.33,-0.16,-1.525%,2447729665.00,United States,2007,553255,Consumer Services,Real Estate Investment Trusts
CINF,Cincinnati Financial Corporation Common Stock,$137.90,-2.38,-1.697%,22124509693.00,United States,,63113,Finance,Property-Casualty Insurers
CINT,CI&T Inc Class A Common Shares,$16.07,-0.44,-2.665%,2124420189.00,,2021,5037,,
CIVI,Civitas Resources Inc. Common Stock,$62.11,-1.46,-2.297%,5275446635.00,United States,2017,183456,Energy,Oil & Gas Production
CIXX,CI Financial Corp. Common Shares,$14.35,-0.45,-3.041%,2810344252.00,,,15034,,
CL,Colgate-Palmolive Company Common Stock,$81.52,-0.58,-0.706%,68525179430.00,United States,,1534357,Consumer Non-Durables,Package Goods/Cosmetics
CLBK,Columbia Financial Inc. Common Stock,$21.68,-0.10,-0.459%,2313287501.00,United States,2018,11922,Finance,Commercial Banks
CLF,Cleveland-Cliffs Inc. Common Stock,$30.32,0.74,2.502%,15900102619.00,United States,,22262669,,
CLH,Clean Harbors Inc. Common Stock,$108.02,-0.75,-0.69%,5965076875.00,United States,,53302,,
CLR,Continental Resources Inc. Common Stock,$60.75,-1.59,-2.551%,22060011845.00,United States,2007,349684,Energy,Oil & Gas Production
CLVT,Clarivate Plc Ordinary Shares,$16.195,-0.125,-0.766%,11070510729.00,,2019,757364,Technology,EDP Services
CLX,Clorox Company (The) Common Stock,$150.33,2.18,1.471%,18499287643.00,United States,,605203,Consumer Durables,Specialty Chemicals
CM,Canadian Imperial Bank of Commerce Common Stock,$114.74,-2.27,-1.94%,51780777891.00,Canada,,95364,,
CMA,Comerica Incorporated Common Stock,$82.12,-0.61,-0.737%,10735492662.00,United States,,588904,Finance,Major Banks
CMC,Commercial Metals Company Common Stock,$43.21,-0.19,-0.438%,5249836456.00,United States,,302758,Basic Industries,Steel/Iron Ore
CMCSA,Comcast Corporation Class A Common Stock,$46.395,-0.545,-1.161%,210319220928.00,United States,,7285466,Consumer Services,Television Services
CME,CME Group Inc. Class A Common Stock,$226.23,-2.14,-0.937%,81312174119.00,United States,2002,247857,Finance,Investment Bankers/Brokers/Service
CMG,Chipotle Mexican Grill Inc. Common Stock,$1509.855,-11.255,-0.74%,42305294601.00,United States,2006,53966,Consumer Services,Restaurants
CMI,Cummins Inc. Common Stock,$202.05,-4.81,-2.325%,28706165656.00,United States,,173587,Capital Goods,Construction/Ag Equipment/Trucks
CMP,Compass Minerals Intl Inc Common Stock,$63.74,0.00,0.00%,2173503469.00,United States,2003,48538,Basic Industries,Precious Metals
CMS,CMS Energy Corporation Common Stock,$72.335,-0.505,-0.693%,20987047598.00,United States,,271028,Public Utilities,Power Generation
CMTG,Claros Mortgage Trust Inc. Common Stock,$19.0384,-0.0216,-0.113%,2659395791.00,,2021,14214,Consumer Services,Real Estate Investment Trusts
CNA,CNA Financial Corporation Common Stock,$48.92,-0.65,-1.311%,13267891367.00,United States,,24063,Finance,Property-Casualty Insurers
CNC,Centene Corporation Common Stock,$85.14,-2.70,-3.074%,49625980480.00,United States,,460385,Health Care,Medical Specialities
CNHI,CNH Industrial N.V. Common Shares,$15.225,-0.435,-2.778%,20646272325.00,,2013,979511,Capital Goods,Construction/Ag Equipment/Trucks
CNI,Canadian National Railway Company Common Stock,$125.23,-2.23,-1.75%,350543816000.00,Canada,,283647,,
CNK,Cinemark Holdings Inc Cinemark Holdings Inc. Common Stock,$16.57,-0.09,-0.54%,2007922310.00,United States,2007,339825,Consumer Services,Movies/Entertainment
CNM,Core & Main Inc. Class A Common Stock,$24.74,-0.20,-0.802%,4144504250.00,,2021,81836,Capital Goods,Industrial Machinery/Components
CNMD,CONMED Corporation Common Stock,$141.805,-8.945,-5.934%,4186584030.00,United States,1987,99425,Health Care,Biotechnology: Electromedical & Electrotherapeutic Apparatus
CNNE,Cannae Holdings Inc. Common Stock,$23.23,-0.34,-1.443%,2018687000.00,,2017,51345,Consumer Services,Catalog/Specialty Distribution
CNO,CNO Financial Group Inc. Common Stock,$25.28,-0.40,-1.558%,2968049541.00,United States,,126487,Finance,Life Insurance
CNP,CenterPoint Energy Inc (Holding Co) Common Stock,$32.04,-0.22,-0.682%,20167014288.00,United States,,1633623,Public Utilities,Electric Utilities: Central
CNQ,Canadian Natural Resources Limited Common Stock,$64.27,-1.88,-2.842%,74716539827.00,Canada,,1203276,,
CNR,Cornerstone Building Brands Inc. Common Stock,$24.40,0.00,0.00%,3099033337.00,United States,,419414,Capital Goods,Metal Fabrications
CNS,Cohen & Steers Inc Common Stock,$83.10,-0.76,-0.906%,4045086123.00,United States,2004,12535,Finance,Investment Managers
CNX,CNX Resources Corporation Common Stock,$21.42,-0.33,-1.517%,4250757295.00,United States,1999,704622,Energy,Oil & Gas Production
CNXC,Concentrix Corporation Common Stock,$153.31,-1.19,-0.77%,8044041707.00,United States,,62153,Technology,Computer Software: Prepackaged Software
COF,Capital One Financial Corporation Common Stock,$137.72,-2.26,-1.615%,55868894297.00,United States,1994,606551,Finance,Finance Companies
COHR,Coherent Inc. Common Stock,$268.34,-1.41,-0.523%,6647559181.00,United States,,127637,Capital Goods,Biotechnology: Laboratory Analytical Instruments
COIN,Coinbase Global Inc. Class A Common Stock,$136.73,-0.59,-0.43%,35809587000.00,United States,,1628747,Technology,EDP Services
COKE,Coca-Cola Consolidated Inc. Common Stock,$488.61,0.92,0.189%,4580078182.00,United States,1972,3676,Consumer Non-Durables,Beverages (Production/Distribution)
COLB,Columbia Banking System Inc. Common Stock,$31.39,0.00,0.00%,2470587116.00,United States,1992,196373,Finance,Major Banks
COLD,Americold Realty Trust Common Shares,$28.42,0.03,0.106%,7634890275.00,United States,2018,182930,Finance,Real Estate
COLM,Columbia Sportswear Company Common Stock,$87.93,-1.08,-1.213%,5535643174.00,United States,1998,78769,Consumer Non-Durables,Apparel
COMP,Compass Inc. Class A Common Stock,$6.025,-0.645,-9.67%,2572265282.00,,2021,1036298,Technology,EDP Services
COO,The Cooper Companies Inc. Common Stock,$394.67,-14.78,-3.61%,19457842739.00,United States,,55301,Health Care,Ophthalmic Goods
COOP,Mr. Cooper Group Inc. Common Stock,$45.44,-0.88,-1.90%,3390317524.00,United States,,171768,Finance,Finance: Consumer Services
COP,ConocoPhillips Common Stock,$98.0968,-0.5732,-0.581%,127138480948.00,United States,,1715847,Energy,Integrated oil Companies
CORT,Corcept Therapeutics Incorporated Common Stock,$22.75,-0.02,-0.088%,2410644350.00,United States,2004,181144,Health Care,Biotechnology: Pharmaceutical Preparations
CORZ,Core Scientific Inc. Common Stock,$6.35,-0.24,-3.642%,2008145406.00,United States,2021,1175886,Technology,EDP Services
COST,Costco Wholesale Corporation Common Stock,$584.29,-7.45,-1.259%,258971520404.00,United States,,906458,Consumer Services,Department/Specialty Retail Stores
COTY,Coty Inc. Class A Common Stock,$8.25,-0.03,-0.362%,6919915472.00,United States,2013,1359204,Consumer Non-Durables,Package Goods/Cosmetics
COUP,Coupa Software Incorporated Common Stock,$91.1748,-0.1552,-0.17%,6885386231.00,United States,2016,543167,Technology,Computer Software: Prepackaged Software
COUR,Coursera Inc. Common Stock,$21.23,-0.77,-3.50%,3051242029.00,,2021,410419,Miscellaneous,Other Consumer Services
CP,Canadian Pacific Railway Limited Common Stock,$75.42,-2.16,-2.784%,70119689503.00,Canada,,419349,,
CPA,Copa Holdings S.A. Copa Holdings S.A. Class A Common Stock,$80.335,-1.285,-1.574%,3368707237.00,Panama,2005,121091,Transportation,Air Freight/Delivery Services
CPB,Campbell Soup Company Common Stock,$47.36,-0.12,-0.253%,14288678328.00,United States,,290613,Consumer Non-Durables,Packaged Foods
CPE,Callon Petroleum Company Common Stock,$58.7737,-2.2663,-3.713%,3614215391.00,United States,,897469,Energy,Oil & Gas Production
CPG,Crescent Point Energy Corporation Ordinary Shares (Canada),$7.14,-0.32,-4.29%,4102657459.00,Canada,,2277541,,
CPK,Chesapeake Utilities Corporation Common Stock,$135.97,-1.56,-1.134%,2406251572.00,United States,,3434,Public Utilities,Oil & Gas Production
CPNG,Coupang Inc. Class A Common Stock,$14.44,0.01,0.069%,25351724061.00,,2021,2490148,Capital Goods,Recreational Products/Toys
CPRI,Capri Holdings Limited Ordinary Shares,$49.70,-0.99,-1.953%,7336479814.00,Hong Kong,2011,233141,Consumer Non-Durables,Apparel
CPRT,Copart Inc. (DE) Common Stock,$118.16,-0.69,-0.581%,28062681322.00,United States,1994,132355,Consumer Services,Other Specialty Stores
CPT,Camden Property Trust Common Stock,$168.985,-1.645,-0.964%,18000666134.00,United States,1993,159214,Consumer Services,Real Estate Investment Trusts
CQP,Cheniere Energy Partners LP Cheniere Energy Partners LP Common Units,$55.65,-0.24,-0.429%,26936109395.00,United States,2007,21249,Public Utilities,Oil/Gas Transmission
CR,Crane Co. Common Stock,$107.21,-2.15,-1.966%,6022392348.00,United States,,41222,Capital Goods,Office Equipment/Supplies/Services
CRC,California Resources Corporation Common Stock,$43.905,-0.705,-1.58%,3426482042.00,,2020,128031,Energy,Oil & Gas Production
CRCT,Cricut Inc. Class A Common Stock,$13.02,-0.48,-3.556%,2890139173.00,United States,2021,120182,Capital Goods,Wholesale Distributors
CRH,CRH PLC American Depositary Shares,$41.59,-0.17,-0.407%,31847185949.00,Ireland,,294964,Capital Goods,Building Materials
CRI,Carter's Inc. Common Stock,$91.39,-1.51,-1.625%,3718096595.00,United States,2003,132815,Consumer Services,Department/Specialty Retail Stores
CRK,Comstock Resources Inc. Common Stock,$16.88,0.04,0.238%,3931733826.00,United States,,1092287,Energy,Oil & Gas Production
CRL,Charles River Laboratories International Inc. Common Stock,$278.63,-13.37,-4.579%,14154130664.00,United States,2000,73036,Consumer Services,EDP Services
CRM,Salesforce Inc. Common Stock,$175.36,-1.87,-1.055%,173606400000.00,United States,2004,2463921,Technology,Computer Software: Prepackaged Software
CROX,Crocs Inc. Common Stock,$72.82,-1.34,-1.807%,4457039343.00,United States,2006,353071,Consumer Non-Durables,Shoe Manufacturing
CRSP,CRISPR Therapeutics AG Common Shares,$55.72,0.19,0.342%,4294205948.00,Switzerland,2016,293397,Health Care,Biotechnology: Biological Products (No Diagnostic Substances)
CRUS,Cirrus Logic Inc. Common Stock,$77.80,-0.42,-0.537%,4456585035.00,United States,1989,61349,Technology,Semiconductors
CRVL,CorVel Corp. Common Stock,$170.58,-4.68,-2.67%,3005706596.00,United States,,6231,Finance,Specialty Insurers
CRWD,CrowdStrike Holdings Inc. Class A Common Stock,$209.50,-0.35,-0.167%,48345866670.00,United States,2019,800889,Technology,EDP Services
CS,Credit Suisse Group American Depositary Shares,$7.28,-0.06,-0.817%,18707303226.00,Switzerland,,4990604,Finance,Investment Bankers/Brokers/Service
CSAN,Cosan S.A. ADS,$18.71,-0.11,-0.584%,8740517573.00,,2021,32860,Consumer Durables,Automotive Aftermarket
CSCO,Cisco Systems Inc. Common Stock (DE),$51.905,-0.875,-1.658%,215622090040.00,United States,1990,5287528,Technology,Computer Communications Equipment
CSGP,CoStar Group Inc. Common Stock,$62.03,0.03,0.048%,24501087279.00,United States,1998,486529,Finance,Real Estate
CSGS,CSG Systems International Inc. Common Stock,$64.53,-0.09,-0.139%,2082550813.00,United States,1996,22355,Technology,EDP Services
CSL,Carlisle Companies Incorporated Common Stock,$248.695,-5.825,-2.289%,12949022909.00,United States,,108703,,
CSQ,Calamos Strategic Total Return Common Stock,$16.26,-0.26,-1.574%,2557872242.00,United States,2004,166511,Finance,Finance Companies
CSTM,Constellium SE Ordinary Shares (France),$17.06,0.08,0.471%,2417015864.00,Netherlands,2013,222711,Basic Industries,Aluminum
CSX,CSX Corporation Common Stock,$35.515,-0.785,-2.163%,77372278289.00,United States,,3774302,Transportation,Railroads
CTAS,Cintas Corporation Common Stock,$415.73,-3.16,-0.754%,42539535250.00,United States,1983,78123,Miscellaneous,Business Services
CTLT,Catalent Inc. Common Stock,$91.65,-0.63,-0.683%,16417091648.00,United States,2014,418890,Health Care,Biotechnology: Pharmaceutical Preparations
CTRA,Coterra Energy Inc. Common Stock,$29.3563,-0.6137,-2.048%,23807336770.00,United States,,2066656,Energy,Oil & Gas Production
CTSH,Cognizant Technology Solutions Corporation Class A Common Stock,$84.70,-1.72,-1.99%,44428099932.00,United States,1998,623016,Technology,EDP Services
CTVA,Corteva Inc. Common Stock ,$58.735,-1.475,-2.45%,42687047690.00,,2019,1082429,Basic Industries,Major Chemicals
CTXS,Citrix Systems Inc. Common Stock,$101.38,-0.18,-0.177%,12765075350.00,United States,1995,359509,Technology,Computer Software: Prepackaged Software
CUBE,CubeSmart Common Shares,$52.89,-0.74,-1.38%,11907304838.00,United States,,108969,Consumer Services,Real Estate Investment Trusts
CUK,Carnival Plc ADS ADS,$17.70,-0.18,-1.007%,20811695064.00,United States,,1080484,Consumer Services,Marine Transportation
CUZ,Cousins Properties Incorporated Common Stock,$38.90,-0.58,-1.469%,5786897544.00,United States,,278371,Consumer Services,Real Estate Investment Trusts
CVAC,CureVac N.V. Ordinary Shares,$16.27,-0.61,-3.614%,3041715646.00,Germany,2020,92404,Health Care,Biotechnology: Pharmaceutical Preparations
CVBF,CVB Financial Corporation Common Stock,$24.09,-0.04,-0.166%,3414605829.00,United States,,257252,Finance,Major Banks
CVCO,Cavco Industries Inc. Common Stock When Issued,$235.66,-1.14,-0.481%,2159491384.00,United States,,6592,Basic Industries,Homebuilding
CVE,Cenovus Energy Inc Common Stock,$17.225,-0.195,-1.119%,34368766900.00,Canada,,2995610,,
CVET,Covetrus Inc. Common Stock,$15.37,-0.37,-2.351%,2129285286.00,United States,,186736,Health Care,Other Pharmaceuticals
CVI,CVR Energy Inc. Common Stock,$26.52,-0.15,-0.562%,2666071485.00,United States,2007,82663,Energy,Integrated oil Companies
CVLT,Commvault Systems Inc. Common Stock,$63.09,-0.67,-1.051%,2811264785.00,United States,2006,24958,Technology,Computer Software: Prepackaged Software
CVNA,Carvana Co. Class A Common Stock,$88.04,4.90,5.894%,7932266746.00,United States,2017,7816553,Consumer Services,Other Specialty Stores
CVS,CVS Health Corporation Common Stock,$103.415,-1.765,-1.678%,135803924831.00,United States,,2161733,Health Care,Managed Health Care
CVT,Cvent Holding Corp. Common Stock,$7.19,-0.02,-0.277%,3459310787.00,United States,1987,29373,Technology,Computer Software: Prepackaged Software
CVX,Chevron Corporation Common Stock,$163.80,-0.78,-0.474%,321844405264.00,United States,,3221364,Energy,Integrated oil Companies
CW,Curtiss-Wright Corporation Common Stock,$155.33,-0.14,-0.09%,5969670053.00,United States,,33790,Capital Goods,Industrial Machinery/Components
CWAN,Clearwater Analytics Holdings Inc. Class A Common Stock,$17.97,-0.01,-0.056%,3206234445.00,,2021,75258,Technology,Computer Software: Prepackaged Software
CWEN,Clearway Energy Inc. Class C Common Stock,$32.52,-0.88,-2.635%,3787607034.00,United States,2015,270018,Public Utilities,Electric Utilities: Central
CWK,Cushman & Wakefield plc Ordinary Shares,$18.525,-0.185,-0.989%,4176378295.00,,2018,94958,Finance,Real Estate
CWST,Casella Waste Systems Inc. Class A Common Stock,$86.14,-1.26,-1.442%,4448159169.00,United States,1997,33273,Public Utilities,Environmental Services
CWT,California Water Service Group Common Stock,$55.39,0.34,0.618%,2978257765.00,United States,,44138,Public Utilities,Water Supply
CX,Cemex S.A.B. de C.V. Sponsored ADR,$4.5021,-0.0779,-1.701%,6631129908.00,Mexico,,1219084,Capital Goods,Building Materials
CXM,Sprinklr Inc. Class A Common Stock,$13.33,0.13,0.985%,3422646751.00,,2021,44766,Technology,Computer Software: Prepackaged Software
CYBR,CyberArk Software Ltd. Ordinary Shares,$163.72,0.59,0.362%,6562787909.00,Israel,2014,50267,Technology,Computer Software: Prepackaged Software
CYTK,Cytokinetics Incorporated Common Stock,$36.77,0.17,0.464%,3143979911.00,United States,2004,83410,Health Care,Biotechnology: Pharmaceutical Preparations
CYXT,Cyxtera Technologies Inc. Class A Common Stock,$12.45,-0.36,-2.81%,2223151082.00,United States,2020,81399,Technology,EDP Services
CZR,Caesars Entertainment Inc. Common Stock,$67.12,-0.99,-1.454%,14371966031.00,United States,,677384,Consumer Services,Hotels/Resorts
D,Dominion Energy Inc. Common Stock,$85.89,-0.66,-0.763%,69628781357.00,United States,,579126,Public Utilities,Electric Utilities: Central
DAL,Delta Air Lines Inc. Common Stock,$44.40,-0.33,-0.738%,28463794957.00,United States,,5917846,Transportation,Air Freight/Delivery Services
DAN,Dana Incorporated Common Stock ,$15.92,-0.48,-2.927%,2305482294.00,United States,,260274,Capital Goods,Auto Parts:O.E.M.
DAR,Darling Ingredients Inc. Common Stock,$81.54,-1.16,-1.403%,13174837649.00,United States,,267648,Consumer Non-Durables,Farming/Seeds/Milling
DASH,DoorDash Inc. Class A Common Stock,$92.14,0.19,0.207%,32102628884.00,,2020,2443425,Capital Goods,Industrial Machinery/Components
DAVA,Endava plc American Depositary Shares (each representing one Class A Ordinary Share),$111.52,-1.00,-0.889%,6244461697.00,United States,2018,26688,Technology,EDP Services
DB,Deutsche Bank AG Common Stock,$11.90,-0.27,-2.219%,24594600259.00,Germany,,4054701,Finance,Commercial Banks
DBRG,DigitalBridge Group Inc.,$6.995,-0.095,-1.34%,4187010175.00,United States,2014,362997,Consumer Services,Real Estate Investment Trusts
DBX,Dropbox Inc. Class A Common Stock,$22.185,0.175,0.795%,8384898242.00,United States,2018,470878,Technology,Computer Software: Prepackaged Software
DCI,Donaldson Company Inc. Common Stock,$51.67,-1.06,-2.01%,57458157054.00,United States,,54644,Capital Goods,Pollution Control Equipment
DCP,DCP Midstream  LP Common Units ,$36.99,-0.58,-1.544%,7707929556.00,United States,,111455,Public Utilities,Natural Gas Distribution
DCT,Duck Creek Technologies Inc. Common Stock,$16.21,-0.02,-0.123%,2148206535.00,United States,2020,109270,Technology,Retail: Computer Software & Peripheral Equipment
DD,DuPont de Nemours Inc. Common Stock,$68.44,-1.23,-1.765%,34803709156.00,,2017,412476,Capital Goods,Wholesale Distributors
DDOG,Datadog Inc. Class A Common Stock,$122.75,0.93,0.763%,38658040112.00,United States,2019,705597,Technology,EDP Services
DDS,Dillard's Inc. Common Stock,$286.54,-16.74,-5.52%,5221135314.00,United States,,83534,Consumer Services,Department/Specialty Retail Stores
DE,Deere & Company Common Stock,$413.905,-10.455,-2.464%,126979566867.00,United States,,491335,Capital Goods,Industrial Machinery/Components
DECK,Deckers Outdoor Corporation Common Stock,$281.285,-7.865,-2.72%,7662564289.00,United States,1993,95686,Consumer Non-Durables,Shoe Manufacturing
DEI,Douglas Emmett Inc. Common Stock,$31.30,-0.25,-0.792%,5501650078.00,United States,2006,111138,Consumer Services,Real Estate Investment Trusts
DELL,Dell Technologies Inc. Class C Common Stock ,$47.47,-0.74,-1.535%,36096109627.00,,2018,644576,Technology,Computer Manufacturing
DEN,Denbury Inc. Common Stock,$70.00,-1.11,-1.561%,3514552020.00,,2020,72679,Energy,Oil & Gas Production
DEO,Diageo plc Common Stock,$203.29,-0.13,-0.064%,117261407250.00,United Kingdom,,99511,Consumer Non-Durables,Beverages (Production/Distribution)
DFS,Discover Financial Services Common Stock,$114.50,-2.03,-1.742%,32292217221.00,United States,,373388,Finance,Finance: Consumer Services
DG,Dollar General Corporation Common Stock,$251.085,-4.745,-1.855%,57444448331.00,United States,2009,375199,Consumer Services,Department/Specialty Retail Stores
DGX,Quest Diagnostics Incorporated Common Stock,$138.27,-3.37,-2.379%,16286245746.00,United States,,364050,Health Care,Medical Specialities
DH,Definitive Healthcare Corp. Class A Common Stock,$24.4006,-0.1594,-0.649%,2380612403.00,United States,2021,156834,Technology,Computer Software: Prepackaged Software
DHI,D.R. Horton Inc. Common Stock,$72.34,-0.92,-1.256%,25634269656.00,United States,,471874,,
DHR,Danaher Corporation Common Stock,$266.00,-12.24,-4.399%,190428042070.00,United States,,738366,Health Care,Medical Specialities
DIDI,DiDi Global Inc. American Depositary Shares (each four representing one Class A Ordinary Share),$1.74,0.03,1.754%,8231131582.00,,2021,16316240,,
DINO,HF Sinclair Corporation Common Stock,$38.3627,-0.1473,-0.382%,8563764830.00,United States,,209331,Energy,Integrated oil Companies
DIOD,Diodes Incorporated Common Stock,$74.70,-0.24,-0.32%,3378814265.00,United States,,34004,Technology,Semiconductors
DIS,Walt Disney Company (The) Common Stock,$120.35,-1.31,-1.077%,219113230653.00,United States,,5613227,Consumer Services,Movies/Entertainment
DISH,DISH Network Corporation Class A Common Stock,$31.12,-0.20,-0.639%,16462846967.00,United States,1995,556870,Consumer Services,Television Services
DK,Delek US Holdings Inc. Common Stock,$23.60,0.17,0.726%,2084366443.00,United States,2017,181006,Energy,Integrated oil Companies
DKL,Delek Logistics Partners L.P. Common Units representing Limited Partner Interests,$54.06,0.79,1.483%,2350034313.00,United States,2012,30126,Energy,Oil & Gas Production
DKNG,DraftKings Inc. Class A Common Stock,$14.10,-0.26,-1.811%,5762348083.00,United States,2019,9639178,Consumer Services,Services-Misc. Amusement & Recreation
DKS,Dick's Sporting Goods Inc Common Stock,$99.45,-4.17,-4.024%,7941055748.00,United States,2002,402609,Consumer Services,Other Specialty Stores
DLB,Dolby Laboratories Common Stock,$77.695,-0.485,-0.62%,7910775926.00,United States,2005,60112,Technology,EDP Services
DLO,DLocal Limited Class A Common Shares,$25.115,-0.275,-1.083%,7409639296.00,Uruguay,2021,276441,,
DLR,Digital Realty Trust Inc. Common Stock,$149.74,-0.60,-0.399%,42596403483.00,United States,2004,288227,Consumer Services,Real Estate Investment Trusts
DLTR,Dollar Tree Inc. Common Stock,$169.095,-3.965,-2.291%,38065031082.00,United States,1995,499764,Consumer Services,Department/Specialty Retail Stores
DNA,Ginkgo Bioworks Holdings Inc. Class A Common Stock,$3.575,0.125,3.623%,6290585287.00,United States,2021,6922695,Health Care,Biotechnology: Biological Products (No Diagnostic Substances)
DNB,Dun & Bradstreet Holdings Inc. Common Stock,$16.92,-0.20,-1.168%,7295326808.00,United States,2020,110622,Technology,EDP Services
DNLI,Denali Therapeutics Inc. Common Stock,$26.80,-0.44,-1.615%,3293550115.00,United States,2017,97022,Health Care,Biotechnology: Biological Products (No Diagnostic Substances)
DNP,DNP Select Income Fund Inc. Common Stock,$11.9799,0.0499,0.418%,4135402383.00,United States,1987,156346,Finance,Investment Managers
DNUT,Krispy Kreme Inc. Common Stock,$14.48,0.16,1.117%,2423039847.00,United States,2021,136301,Consumer Services,Specialty Foods
DOC,Physicians Realty Trust Common Shares of Beneficial Interest,$17.555,-0.125,-0.707%,3952425303.00,United States,2013,866625,Consumer Services,Real Estate Investment Trusts
DOCN,DigitalOcean Holdings Inc. Common Stock,$45.27,0.20,0.444%,4871651918.00,United States,2021,459922,Technology,Retail: Computer Software & Peripheral Equipment
DOCS,Doximity Inc. Class A Common Stock,$46.17,-1.82,-3.792%,8832967334.00,,2021,363765,Technology,Retail: Computer Software & Peripheral Equipment
DOCU,DocuSign Inc. Common Stock,$86.90,-0.52,-0.595%,17281704542.00,United States,2018,1226932,Technology,EDP Services
DOOO,BRP Inc. (Recreational Products) Common Subordinate Voting Shares,$81.09,-1.06,-1.29%,6571165857.00,Canada,,31619,,
DORM,Dorman Products Inc. Common Stock,$94.12,-1.24,-1.30%,2967395030.00,United States,,15013,Capital Goods,Auto Parts:O.E.M.
DOV,Dover Corporation Common Stock,$141.34,-2.82,-1.956%,20367962817.00,United States,,320232,Capital Goods,Industrial Machinery/Components
DOW,Dow Inc. Common Stock ,$70.22,0.71,1.021%,51617728598.00,,2019,2767225,Basic Industries,Industrial Specialties
DOX,Amdocs Limited Ordinary Shares,$82.55,-0.60,-0.722%,10182872700.00,Guernsey,,164595,Technology,EDP Services
DPZ,Domino's Pizza Inc Common Stock,$385.23,-5.77,-1.476%,13881112782.00,United States,2004,76398,Consumer Non-Durables,Food Distributors
DQ,DAQO New Energy Corp. American Depositary Shares each representing five ordinary shares,$41.92,1.39,3.43%,3123330506.00,China,2010,637558,Technology,Semiconductors
DRE,Duke Realty Corporation Common Stock,$60.45,-0.56,-0.918%,23138308190.00,United States,,173573,Consumer Services,Real Estate Investment Trusts
